product_id,category_id,created_at,description,image_path,name,price,stock_quantity,updated_at
1,9,"2024-08-12 13:02:25.999646","This is A carved wood man that is created for displaying in common area represents luck and protection from bad spirits ",https://african-arts-and-crafts-bucket.s3.eu-north-1.amazonaws.com/Carved.webp,"Carved Tribes man",1999.99,8,"2024-08-15 18:44:44.639539"
3,1,"2024-08-12 13:16:38.762468","This hand made stone elephant was made in the north provinces of South Africa as replicate of a real elephant in the Kruger national park",https://african-arts-and-crafts-bucket.s3.eu-north-1.amazonaws.com/elephant.webp,"Stone Elephant",1399.99,2,"2024-08-15 18:45:27.085121"
4,13,"2024-08-12 16:30:37.562604","This is a two piece sculpture made of ceramic  ",https://african-arts-and-crafts-bucket.s3.eu-north-1.amazonaws.com/Twins.webp,Twins,2999.99,3,"2024-08-12 16:30:37.562604"
5,9,"2024-08-12 16:35:19.796367","Exotic African Sculpture representing the praying African Mother ",https://african-arts-and-crafts-bucket.s3.eu-north-1.amazonaws.com/praying.webp,"The Praying Mother",800.99,10,"2024-08-12 16:35:19.796367"
6,13,"2024-08-12 17:03:08.553643","Dimensions: Height: 9.45 in (24 cm)Width: 7.09 in (18 cm)Depth: 6.3 in (16 cm)",https://african-arts-and-crafts-bucket.s3.eu-north-1.amazonaws.com/f_2263852_1631088618301_bg_processed.webp,"Exotic African Women",1499.99,8,"2024-08-12 17:03:08.553643"
7,5,"2024-08-12 17:44:55.694939","African Shona Art Sculpture from Zimbabwe's Shona Tribe",https://african-arts-and-crafts-bucket.s3.eu-north-1.amazonaws.com/IMG_5037_master.webp,"Shona Art",1995.99,8,"2024-08-12 17:44:55.694939"
8,9,"2024-08-12 20:37:18.979583","A simple Hand Made modern wood sculpture of a woman ",https://african-arts-and-crafts-bucket.s3.eu-north-1.amazonaws.com/kenyan+model.webp,"Modern woman ",1701.63,17,"2024-08-15 21:43:12.907319"
